{
  "claim_version": "v0.0.1",
  "claim_id": "claim_core_2026_05_01",
  "generated_at": "2026-09-19T22:00:00Z",
  "claimant": {
    "organization": "Forge Signals",
    "owner_id": "team.platform"
  },
  "das_version": "v0.002",
  "scope": {
    "core_conformant": true,
    "overlay_claims": []
  },
  "disclosures": {
    "last_required_drill_pass_at": {
      "D1": "2026-09-19T16:00:00Z",
      "D2": "2026-09-19T16:30:00Z"
    },
    "known_exceptions": [
      {
        "exception_id": "exc_0001",
        "status": "approved",
        "expires_at": "2026-12-31T12:00:00Z",
        "notes": "Approval latency SLO pipeline pending."
      }
    ],
    "non_certification_statement": "This claim is a self-asserted conformance statement and not a certification."
  },
  "evidence": {
    "conformance_report_ref": "../../../conformance-report.json",
    "exceptions_ref": "das1/examples/exceptions",
    "notes": "Core claim based on seed verifier outputs and evidence pack."
  },
  "attestation": {
    "statement": "I attest this claim is accurate to the best of my knowledge and supported by the referenced evidence.",
    "attester_id": "user.security",
    "attested_at": "2026-09-19T22:05:00Z"
  }
}
